{
  "version": "1.0",
  "policy": "fresh-3d-motion-with-precision-teaching-modes",
  "decisions": [
    {
      "scene_id": "s01-title",
      "selected_strategy": "generated_3d_video",
      "provider": "modelslab",
      "model_candidates": [
        "h3-minimax-r2v",
        "wan-2.2-i2v",
        "wan2.2",
        "h3-minimax-t2v"
      ],
      "reason": "Continuous story or explanation motion is required.",
      "fresh_asset_required": true,
      "stock_search_required": false,
      "status": "planned"
    },
    {
      "scene_id": "s02-objectives",
      "selected_strategy": "generated_3d_video",
      "provider": "modelslab",
      "model_candidates": [
        "h3-minimax-r2v",
        "wan-2.2-i2v",
        "wan2.2",
        "h3-minimax-t2v"
      ],
      "reason": "Continuous story or explanation motion is required.",
      "fresh_asset_required": true,
      "stock_search_required": false,
      "status": "planned"
    },
    {
      "scene_id": "s03-startup",
      "selected_strategy": "generated_3d_video",
      "provider": "modelslab",
      "model_candidates": [
        "h3-minimax-r2v",
        "wan-2.2-i2v",
        "wan2.2",
        "h3-minimax-t2v"
      ],
      "reason": "Continuous story or explanation motion is required.",
      "fresh_asset_required": true,
      "stock_search_required": false,
      "status": "planned"
    },
    {
      "scene_id": "s04-spherical-earth",
      "selected_strategy": "generated_3d_video",
      "provider": "modelslab",
      "model_candidates": [
        "h3-minimax-r2v",
        "wan-2.2-i2v",
        "wan2.2",
        "h3-minimax-t2v"
      ],
      "reason": "Continuous story or explanation motion is required.",
      "fresh_asset_required": true,
      "stock_search_required": false,
      "status": "planned"
    },
    {
      "scene_id": "s05-two-movements",
      "selected_strategy": "generated_3d_video",
      "provider": "modelslab",
      "model_candidates": [
        "h3-minimax-r2v",
        "wan-2.2-i2v",
        "wan2.2",
        "h3-minimax-t2v"
      ],
      "reason": "Continuous story or explanation motion is required.",
      "fresh_asset_required": true,
      "stock_search_required": false,
      "status": "planned"
    },
    {
      "scene_id": "s06-rotation",
      "selected_strategy": "generated_3d_video",
      "provider": "modelslab",
      "model_candidates": [
        "h3-minimax-r2v",
        "wan-2.2-i2v",
        "wan2.2",
        "h3-minimax-t2v"
      ],
      "reason": "Continuous story or explanation motion is required.",
      "fresh_asset_required": true,
      "stock_search_required": false,
      "status": "planned"
    },
    {
      "scene_id": "s07-do-you-know",
      "selected_strategy": "generated_3d_video",
      "provider": "modelslab",
      "model_candidates": [
        "h3-minimax-r2v",
        "wan-2.2-i2v",
        "wan2.2",
        "h3-minimax-t2v"
      ],
      "reason": "Continuous story or explanation motion is required.",
      "fresh_asset_required": true,
      "stock_search_required": false,
      "status": "planned"
    },
    {
      "scene_id": "s08-revolution",
      "selected_strategy": "generated_3d_video",
      "provider": "modelslab",
      "model_candidates": [
        "h3-minimax-r2v",
        "wan-2.2-i2v",
        "wan2.2",
        "h3-minimax-t2v"
      ],
      "reason": "Continuous story or explanation motion is required.",
      "fresh_asset_required": true,
      "stock_search_required": false,
      "status": "planned"
    },
    {
      "scene_id": "s09-day-length",
      "selected_strategy": "generated_3d_video",
      "provider": "modelslab",
      "model_candidates": [
        "h3-minimax-r2v",
        "wan-2.2-i2v",
        "wan2.2",
        "h3-minimax-t2v"
      ],
      "reason": "Continuous story or explanation motion is required.",
      "fresh_asset_required": true,
      "stock_search_required": false,
      "status": "planned"
    },
    {
      "scene_id": "s10-solstice",
      "selected_strategy": "generated_3d_video",
      "provider": "modelslab",
      "model_candidates": [
        "h3-minimax-r2v",
        "wan-2.2-i2v",
        "wan2.2",
        "h3-minimax-t2v"
      ],
      "reason": "Continuous story or explanation motion is required.",
      "fresh_asset_required": true,
      "stock_search_required": false,
      "status": "planned"
    },
    {
      "scene_id": "s11-inertia",
      "selected_strategy": "generated_3d_video",
      "provider": "modelslab",
      "model_candidates": [
        "h3-minimax-r2v",
        "wan-2.2-i2v",
        "wan2.2",
        "h3-minimax-t2v"
      ],
      "reason": "Continuous story or explanation motion is required.",
      "fresh_asset_required": true,
      "stock_search_required": false,
      "status": "planned"
    },
    {
      "scene_id": "s12-equinox",
      "selected_strategy": "generated_3d_video",
      "provider": "modelslab",
      "model_candidates": [
        "h3-minimax-r2v",
        "wan-2.2-i2v",
        "wan2.2",
        "h3-minimax-t2v"
      ],
      "reason": "Continuous story or explanation motion is required.",
      "fresh_asset_required": true,
      "stock_search_required": false,
      "status": "planned"
    },
    {
      "scene_id": "s13-recall",
      "selected_strategy": "stable_teaching_ui",
      "provider": "hyperframes",
      "model_candidates": [],
      "reason": "The learner must read or answer source-faithful content on a stable screen.",
      "fresh_asset_required": false,
      "stock_search_required": false,
      "status": "planned"
    },
    {
      "scene_id": "s14-remember",
      "selected_strategy": "stable_teaching_ui",
      "provider": "hyperframes",
      "model_candidates": [],
      "reason": "The learner must read or answer source-faithful content on a stable screen.",
      "fresh_asset_required": false,
      "stock_search_required": false,
      "status": "planned"
    },
    {
      "scene_id": "s15-wordbank",
      "selected_strategy": "stable_teaching_ui",
      "provider": "hyperframes",
      "model_candidates": [],
      "reason": "The learner must read or answer source-faithful content on a stable screen.",
      "fresh_asset_required": false,
      "stock_search_required": false,
      "status": "planned"
    }
  ],
  "blocked_scene_ids": []
}